{
  "base_report": {
    "content_digest": "ef265eea160d25549467a8cc26d83a24d26f7032bab0b7cd6bfa5993b0fa59b4",
    "report_id": "atlrep-e97c8dde15e815410c8ae7368d849de6",
    "schema_version": "6.0.0"
  },
  "changed_dimensions": [],
  "compare_report": {
    "content_digest": "8641fffdd7aca8aa6c29bf313a27c73d7b23c100f0f2f86906851298303ca7d7",
    "report_id": "atlrep-b9d6c3e7ccc7360a3ec73262a3f68285",
    "schema_version": "6.0.0"
  },
  "comparison": {
    "acknowledgement": "not_required",
    "axis": "same_state_observer_change",
    "comparability": "comparable",
    "context": {
      "base": {
        "environment_context": "synthetic",
        "experiment_id": "E02_rooted_avd",
        "measurement_id": "atlevent-1e942d7afbe785ee101fd1ce35daf878",
        "observer": "adb_shell",
        "observer_effective_uid_is_root": "false",
        "observer_privilege": "shell",
        "protocol": "adb",
        "report_schema_version": "6.0.0",
        "state_id": "state-e02-rooted-avd",
        "target_class": "avd",
        "target_pseudonym": "target-synthetic-avd"
      },
      "compare": {
        "environment_context": "synthetic",
        "experiment_id": "E02_rooted_avd",
        "measurement_id": "atlevent-a7183482b0296965db640dee0367b85d",
        "observer": "root_collector",
        "observer_effective_uid_is_root": "true",
        "observer_privilege": "root",
        "protocol": "root",
        "report_schema_version": "6.0.0",
        "state_id": "state-e02-rooted-avd",
        "target_class": "avd",
        "target_pseudonym": "target-synthetic-avd"
      }
    },
    "reasons": [
      "target_identity_matches",
      "target_class_matches",
      "state_identity_matches",
      "experiment_matches",
      "protocol_differs",
      "observer_differs",
      "observer_privilege_differs",
      "observer_effective_uid_differs",
      "report_schema_matches",
      "environment_context_matches",
      "measurement_differs"
    ],
    "visibility_context_changed": true,
    "warnings": [
      "observer_context_changed_visibility_may_differ"
    ]
  },
  "compatibility": {
    "canonical_comparison_schema_version": "6.0.0",
    "input_schema_versions": {
      "base": "6.0.0",
      "compare": "6.0.0"
    },
    "migration_mode": "temporary_in_memory",
    "migrations": {
      "base": [],
      "compare": []
    },
    "warnings": []
  },
  "confidence_changes": [
    {
      "after": {
        "command_success": "complete",
        "corroborating_signal_count": 4,
        "level": "low",
        "observer_capability": "root",
        "source_quality": "legacy_inferred",
        "target_limitations": [
          "hardware_attestation_not_collected",
          "legacy_capture_status_inferred",
          "virtual_target_not_hardware_backed"
        ]
      },
      "before": {
        "command_success": "complete",
        "corroborating_signal_count": 4,
        "level": "low",
        "observer_capability": "shell",
        "source_quality": "legacy_inferred",
        "target_limitations": [
          "hardware_attestation_not_collected",
          "legacy_capture_status_inferred",
          "virtual_target_not_hardware_backed"
        ]
      },
      "path": "verified_boot.confidence"
    }
  ],
  "content_digest": "7d65358e72f6ac4227d25957d5f6355d679bf343b1aef463d85c92a9895adb3c",
  "diff_id": "atldiff-7d65358e72f6ac4227d25957d5f6355d",
  "missing_signals": [],
  "new_signals": [],
  "provenance": {
    "base": {
      "applied_migrations": [],
      "common_report": {
        "content_digest": "ef265eea160d25549467a8cc26d83a24d26f7032bab0b7cd6bfa5993b0fa59b4",
        "report_id": "atlrep-e97c8dde15e815410c8ae7368d849de6",
        "schema_version": "6.0.0"
      },
      "original_content_digest": "ef265eea160d25549467a8cc26d83a24d26f7032bab0b7cd6bfa5993b0fa59b4",
      "original_document_digest": "ed18e313ffe09b89624dc91395ed46176e62774dd10be21f88b95c36296503c0",
      "original_report_id": "atlrep-e97c8dde15e815410c8ae7368d849de6",
      "original_schema_version": "6.0.0"
    },
    "common_report_schema_version": "6.0.0",
    "compare": {
      "applied_migrations": [],
      "common_report": {
        "content_digest": "8641fffdd7aca8aa6c29bf313a27c73d7b23c100f0f2f86906851298303ca7d7",
        "report_id": "atlrep-b9d6c3e7ccc7360a3ec73262a3f68285",
        "schema_version": "6.0.0"
      },
      "original_content_digest": "8641fffdd7aca8aa6c29bf313a27c73d7b23c100f0f2f86906851298303ca7d7",
      "original_document_digest": "f5e9bd90fd9dc2604e7a157a07931a4e1099902a74dcef229316227c91a1ae1e",
      "original_report_id": "atlrep-b9d6c3e7ccc7360a3ec73262a3f68285",
      "original_schema_version": "6.0.0"
    }
  },
  "schema_version": "2.7.0",
  "summary": "0 dimensions changed, 28 dimensions unchanged; 0 signals became available, 0 signals became unavailable.",
  "unchanged_dimensions": [
    "bootloader_lock_state",
    "verified_boot_state",
    "vbmeta_state",
    "verity_mode",
    "selinux_mode",
    "selinux_current_context",
    "selinux_denial_collection",
    "selected_process_visibility",
    "mount_integrity",
    "system_mount_resolution",
    "dynamic_partition_state",
    "apex_mount_set",
    "root_shell_availability",
    "su_binary_visibility",
    "su_invocation_tested",
    "su_invocation_result",
    "root_management_artifact",
    "magisk_binary_visibility",
    "magisk_daemon_visibility",
    "magisk_process_visibility",
    "zygisk_visibility",
    "magisk_version_name",
    "magisk_version_code",
    "magisk_module_context",
    "magisk_command_status",
    "property_consistency",
    "emulator_state",
    "app_visible_state"
  ]
}
